{
  "$schema": "./schemas/agent-config.schema.json",
  "version": "1.0.0",
  "name": "curated-skills-governance-harness",
  "description": "Machine-checkable companion to AGENTS.md. Validated by scripts/validate_agent_config.py; not an industry standard, since the AGENTS.md specification defines no config format.",
  "owner": "kazaxlabs",

  "governing_document": {
    "path": "AGENTS.md",
    "max_characters": 12000,
    "reason": "Antigravity caps rules files at 12,000 characters and drops the excess silently.",
    "source": "https://antigravity.google/docs/rules-workflows/",
    "bridges": [
      {
        "path": "CLAUDE.md",
        "mechanism": "import",
        "must_contain": "@AGENTS.md"
      }
    ]
  },

  "protocols": {
    "startup": {
      "canonical_file_check": true,
      "state_recovery": true,
      "context_budgeting": true
    },

    "evidence_gate": {
      "require_load_bearing_registration": true,
      "citation_must_resolve_200": true,
      "source_tiers": ["standards_body", "primary_vendor", "industry_educator", "practitioner"],
      "self_authored_tests_are_not_evidence": true,
      "mcp_decision_record": true
    },

    "pipeline": {
      "skill": "planner",
      "ordering": "default_path_with_reentry",
      "stages": [
        {
          "id": 1,
          "name": "planning",
          "skills": ["concise-planning", "brainstorming"],
          "verdict": "review",
          "verdict_note": "Scope in/out written; 6-10 atomic verb-first tasks; open questions named."
        },
        {
          "id": 2,
          "name": "architecture",
          "skills": ["senior-architect", "architecture"],
          "verdict": "review",
          "verdict_note": "Module boundaries stated; decision and alternatives recorded. Deletion test applied."
        },
        {
          "id": 3,
          "name": "implementation_tdd",
          "skills": ["test-driven-development", "testing-patterns"],
          "verdict": "machine",
          "verdict_note": "Test command exits 0. Reports intent encoded, NOT capability verified - the agent authored both sides."
        },
        {
          "id": 4,
          "name": "clean_code",
          "skills": ["clean-code", "code-refactoring-refactor-clean"],
          "verdict": "review",
          "verdict_note": "Domain logic concentrated; no pass-through seams added."
        },
        {
          "id": 5,
          "name": "technical_validation",
          "skills": ["lint-and-validate", "systematic-debugging", "error-handling-patterns"],
          "verdict": "machine",
          "verdict_note": "Linter and typecheck exit 0; failure paths have declared behaviour."
        },
        {
          "id": 6,
          "name": "ux_visual_validation",
          "skills": ["ui-visual-validator", "ui-ux-pro-max", "frontend-design", "web-design-guidelines"],
          "verdict": "machine",
          "verdict_note": "Rendered and inspected at real viewport sizes; defects fixed, not noted.",
          "skippable_when": "The change produces no user-facing surface, or the session is non-interactive - in which case proceed under a stated written assumption and flag it."
        },
        {
          "id": 7,
          "name": "production_review",
          "skills": ["production-code-audit", "code-reviewer", "kaizen"],
          "verdict": "review",
          "verdict_note": "Self-review. Does not count as verification; every finding fixed or explicitly accepted with a reason."
        },
        {
          "id": 8,
          "name": "final_verification",
          "skills": ["verification-before-completion"],
          "verdict": "machine",
          "verdict_note": "Build/test command run in the reporting message, against something the agent did not author."
        }
      ]
    },

    "plain_english_summary": {
      "enabled": true,
      "marker": "**In plain English:**",
      "sentence_range": [2, 4],
      "session_override_command": "/plainsummary"
    }
  },

  "manifest": {
    "skills": [
      "planner",
      "concise-planning",
      "brainstorming",
      "senior-architect",
      "architecture",
      "test-driven-development",
      "testing-patterns",
      "clean-code",
      "code-refactoring-refactor-clean",
      "lint-and-validate",
      "systematic-debugging",
      "error-handling-patterns",
      "ui-visual-validator",
      "ui-ux-pro-max",
      "frontend-design",
      "web-design-guidelines",
      "production-code-audit",
      "code-reviewer",
      "kaizen",
      "verification-before-completion",
      "the-humanizer"
    ],
    "mcp_servers": ["harness-and-harden"],
    "commands": ["plainsummary", "evidence", "humanize", "the-humanizer"]
  }
}
